Name,Products,Brand,Color ,Price,Size,Formula,Ingredients,About,URL
The Dewy Skin Cream Plumping & Hydrating Moisturizer,Moisturizer,Tatcha,,97,50 mL,Cream,"AQUA/WATER/EAU, SACCHAROMYCES/RICE FERMENT FILTRATE, GLYCERIN, PROPANEDIOL, DIMETHICONE, SQUALANE, DIISOSTEARYL MALATE, BEHENYL ALCOHOL, MYRISTYL MYRISTATE, DIPENTAERYTHRITYL HEXAHYDROXYSTEARATE, BIS-DIGLYCERYL POLYACYLADIPATE-2, TRIDECYL TRIMELLITATE, INOSITOL, SORBITAN TRISTEARATE, BEHENETH-20, CAMELLIA SINENSIS LEAF EXTRACT, CLADOSIPHON OKAMURANUS EXTRACT, CHONDRUS CRISPUS EXTRACT, BETAPHYCUS GELATINUM EXTRACT, ORYZA SATIVA (RICE) BRAN EXTRACT, PANAX GINSENG ROOT EXTRACT, ORIGANUM MAJORANA LEAF EXTRACT, THYMUS SERPYLLUM EXTRACT, MALVA SYLVESTRIS (MALLOW) FLOWER EXTRACT, SODIUM HYALURONATE, GOLD, SERICIN, PHYTOSTERYL MACADAMIATE, TOCOPHEROL, HYDROXYETHYL ACRYLATE/SODIUM ACRYLOYLDIMETHYL TAURATE COPOLYMER, SORBITAN ISOSTEARATE, POLYSORBATE 60, BUTYLENE GLYCOL, DIMETHICONE/VINYL DIMETHICONE CROSSPOLYMER, SODIUM BENZOATE, GLUCONOLACTONE, ETHYLHEXYLGLYCERIN, PARFUM/FRAGRANCE, ALCOHOL, PHENOXYETHANOL, CITRAL, LIMONENE, LINALOOL, MICA, TIN OXIDE, TITANIUM DIOXIDE (CI 77891), VIOLET 2 (CI 60725)","A rich moisturizer that hydrates, seals in moisture, visibly plumps fine lines, and protects from skin-aging oxidative stress. For normal and dry skin. To treat dryness, dullness, fine lines, and wrinkles. This product is cruelty-free and gluten-free",https://www.sephora.com/ca/en/product/the-dewy-skin-cream-P441101?skuId=2181006&icid2=products%20grid:p441101:product
Natural Moisturizing Factors + HA,Moisturizer,The Ordinary,,18.1,100 mL,Cream,"Water, Caprylic/Capric Triglyceride, Cetyl Alcohol, Propanediol, Stearyl Alcohol, Glycerin, Sodium Hyaluronate, Arginine, Aspartic Acid, Glycine, Alanine, Serine, Valine, Isoleucine, Proline, Threonine, Histidine, Phenylalanine, Glucose, Maltose, Fructose, Trehalose, Sodium PCA, PCA, Sodium Lactate, Urea, Allantoin, Linoleic Acid, Oleic Acid, Phytosteryl Canola Glycerides, Palmitic Acid, Stearic Acid, Lecithin, Triolein, Tocopherol, Carbomer, Isoceteth-20, Polysorbate 60, Sodium Chloride, Citric Acid, Trisodium Ethylenediamine Disuccinate, Pentylene Glycol, Triethanolamine, Sodium Hydroxide, Phenoxyethanol, Chlorphenesin.","This formula offers non-greasy hydration that acts as a direct topical supplement of natural moisturizing factor components. It contains 11 amino acids, phospholipids, alpha/beta/gamma fatty acids, triglycerides, sterols and sterol esters, glycerin, ceramide precursors, urea, saccharides, sodium PCA, and hyaluronic acid, offering immediate hydration and lasting results with continued use. Good for normal, oily, combination, dry, and sensitive skin. Solution for dryness. This product is vegan, cruelty-free, and formulated without oil, alcohol, silicone, gluten, and fragrance.

",https://www.sephora.com/ca/en/product/the-ordinary-deciem-natural-moisturizing-factors-ha-P427414?skuId=2210581&icid2=products%20grid:p427414:product
Ultra Repair® Cream Intense Hydration,Moisturizer,First Aid Beauty,,51.5,170 g,Cream,"Aqua (Water, Eau), Stearic Acid, Glycerin, C12-15 Alkyl Benzoate, Caprylic/Capric Triglyceride, Glyceryl Stearate SE, Glyceryl Stearate, Cetearyl Alcohol, Colloidal Oatmeal, Squalane, Ceramide NP, Allantoin, Chrysanthemum Parthenium (Feverfew) Extract, Camellia Sinensis Leaf Extract, Glycyrrhiza Glabra (Licorice) Root Extract, Eucalyptus Globulus (Eucalyptus) Leaf Oil, Butyrospermum Parkii (Shea) Butter, Dimethicone, Glycol, Xanthan Gum, Phenoxyethanol, Sodium Hydroxide, Tetrasodium EDTA.","A fast-absorbing, rich moisturizer that provides hydration for dry, distressed skin. For skincare concerns of dryness, fine lines, wrinkles, and redness. This product is vegan, cruelty-free, and gluten-free, comes in recyclable packaging, and is reef safe.",https://www.sephora.com/ca/en/product/ultra-repair-cream-intense-hydration-P381145?skuId=1466762&icid2=products%20grid:p381145:product
Green Tea Seed Hyaluronic Acid Hydrating Cream,Moisturizer,innisfree,,39,50 mL,Cream,"Water / Aqua / Eau, Propanediol, Glycerin, Stearyl Dimethicone, Methyl Trimethicone, Pentaerythrityl Tetraethylhexanoate, Butylene Glycol Dicaprylate/Dicaprate, Glyceryl Polymethacrylate, 1,2-Hexanediol, Polymethylsilsesquioxane, Squalane, Hydroxyethyl Acrylate/Sodium Acryloyldimethyl Taurate Copolymer, Polyglyceryl-3 Methylglucose Distearate, Carbomer, Hydrogenated Lecithin, Cholesterol, Glyceryl Stearate, Tromethamine, Sodium Stearoyl Glutamate, Lactobacillus Ferment Lysate, Hyaluronic Acid, Panthenol, Allantoin, Sodium Metaphosphate, Camellia Sinensis Seed Oil, Cetearyl Alcohol, Xanthan Gum, Glyceryl Caprylate, Butylene Glycol, Ethylhexylglycerin, Sorbitan Isostearate, Sodium Hyaluronate, Camellia Sinensis Leaf Extract, Madecassoside, Lactic Acid, Dextrin, Theobroma Cacao (Cocoa) Extract, Hydrolyzed Hyaluronic Acid, Sodium Hyaluronate Crosspolymer, Camellia Sinensis Seed Extract, Ceramide NP, Tocopherol, Phytosphingosine, Sodium Acetylated Hyaluronate.","A daily moisturizing cream with Green Tea, Hyaluronic Acid, and squalane to help deeply hydrate and strengthen skin's moisture barrier. For skin types normal, dry, combination, and oily. For skincare concerns of dryness. ",https://www.sephora.com/ca/en/product/green-tea-seed-hyaluronic-acid-hydrating-cream-P503891?skuId=2740520&icid2=products%20grid:p503891:product
Superfood Air-Whip Lightweight Face Moisturizer with Hyaluronic Acid,Moisturizer,Youth To The People,,65,59 mL,Gel,"AQUA/WATER/EAU, GLYCERIN, CAPRYLIC/CAPRIC TRIGLYCERIDE, PENTAERYTHRITYL TETRAETHYLHEXANOATE, PENTYLENE GLYCOL, BETAINE, SQUALANE, HELIANTHUS ANNUUS SEED OIL/SUNFLOWER SEED OIL, ALOE BARBADENSIS LEAF JUICE POWDER, BRASSICA OLERACEA ACEPHALA LEAF EXTRACT, CAMELLIA SINENSIS LEAF EXTRACT, CHAMOMILLA RECUTITA FLOWER EXTRACT/MATRICARIA FLOWER EXTRACT, MEDICAGO SATIVA EXTRACT/ALFALFA EXTRACT, SARCOSINE, SPINACIA OLERACEA/SPINACH LEAF EXTRACT, COPPER PCA, HYDROLYZED SODIUM HYALURONATE, HYDROXYACETOPHENONE, MENTHOXYPROPANEDIOL, PENTAERYTHRITYL TETRA-DI-T-BUTYL HYDROXYHYDROCINNAMATE, SODIUM HYALURONATE, SODIUM HYDROXIDE, TETRASODIUM GLUTAMATE DIACETATE, 3-O-ETHYL ASCORBIC ACID, PANTHENOL, TOCOPHEROL, HYDROGENATED LECITHIN, ACRYLATES/C10-30 ALKYL ACRYLATE CROSSPOLYMER, CARBOMER, CETEARYL ALCOHOL, CETEARYL GLUCOSIDE, CITRIC ACID, GLYCINE SOJA OIL/SOYBEAN OIL, LIMONENE, CHLORPHENESIN, PHENOXYETHANOL, PARFUM/FRAGRANCE.","A lightweight gel moisturizer that visibly plumps, provides up to 48 hours of continuous hydration, and helps strengthen moisture barrier function in one hour. For normal, combination, and oily skin. For skinscare concerns of fine lines, wrinkles, dryness, and loss of firmness and elasticity. This product is vegan, cruelty-free, and comes in recyclable packaging. ",https://www.sephora.com/ca/en/product/kale-spinach-hyaluronic-acid-age-prevention-cream-P411388?skuId=1863604&icid2=products%20grid:p411388:product
Superfood Gentle Antioxidant Refillable Cleanser,Cleanser,Youth To The People,,53,237 mL,Liquid,"Water/Aqua/Eau, Cocamidopropyl Hydroxysultaine, Sodium Cocoyl Glutamate, Sorbeth-230 Tetraoleate, Polysorbate 20, Sodium Chloride, Aloe Barbadensis Leaf (Aloe Vera) Juice Powder, Brassica Oleracea Acephala (Kale) Leaf Extract, Spinacia Oleracea (Spinach) Leaf Extract, Camellia Sinensis (Green Tea) Leaf Extract, Medicago Sativa (Alfalfa) Extract, Chamomilla Recutita (Matricaria) Flower Extract, Tetrahexyldecyl Ascorbate (Vitamin C), Glycerin, Panthenol (Vitamin B5), Tocopheryl Acetate (Vitamin E), Decyl Glucoside, Sorbitan Laurate, Tetrasodium Glutamate Diacetate, Gluconolactone, Ethylhexylglycerin, Maltodextrin, Citric Acid, Phenoxyethanol, Potassium Sorbate, Sodium Benzoate, Gardenia Jasminoides (Jasmine) Fruit Extract, Fragrance/Parfum, Sodium Hydroxide, Sodium Glycolate, Sodium Formate, Hexyl Cinnamal, Linalool, Limonene, Chlorophyllin-Copper Complex (CI 75810).","A pH-balanced, non-drying face cleanser formulated with antioxidants to gently yet effectively remove makeup, SPF, and excess oils that can clog pores. For normal, dry, combination, and oily skin. To treat skincare concerns of pores, acne and blemishes, and oiliness. This product is vegan, cruelty-free, and comes in recyclable packaging.",https://www.sephora.com/ca/en/product/kale-spinach-green-tea-age-prevention-cleanser-P411387?skuId=1863588&icid2=products%20grid:p411387:product
Avocado Ceramide Moisture Barrier Cleanser,Cleanser,Glow Recipe,,38,150 mL,Cream,"Water/Aqua/Eau, Glycerin, Sodium Cocoyl Alaninate, Sodium Methyl Cocoyl Taurate, Acrylates/C10-30 Alkyl Acrylate Crosspolymer, Inulin, Butylene Glycol, Ceramide NP, Colloidal Oatmeal, Caprylyl Glycol, Lauryl Hydroxysultaine, Coco-Glucoside, Sodium Hyaluronate, Persea Gratissima (Avocado) Oil, Persea Gratissima (Avocado) Fruit Extract, Saccharide Isomerate, Micrococcus Lysate, Glyceryl Caprylate, Polyglyceryl-10 Laurate, Styrene/Acrylates Copolymer, Sodium Cocoyl Isethionate, 1,2-Hexanediol, Epidermidibacterium Keratini Ferment Filtrate, Quillaja Saponaria Bark Extract, Sodium Phytate, Lecithin, Dipotassium Glycyrrhizate, Citric Acid, Moringa Oleifera Seed Oil, Sodium Citrate, Butyl Avocadate, Arginine, Phytosphingosine, Hydrogenated Lecithin, Hydroxypropyltrimonium Hyaluronate, Mannose, Hydrolyzed Hyaluronic Acid, Sodium Acetylated Hyaluronate, Maltodextrin, Tocopherol, Hyaluronic Acid, Hydrolyzed Sodium Hyaluronate, Sodium Hyaluronate Crosspolymer, Potassium Hyaluronate, Xanthan Gum, Aloe Ferox Leaf Extract, Hexylene Glycol, Triacetin, Gardenia Florida Fruit Extract, Dextrin, Fragrance/Parfum*. *100% Naturally Derived Fragrance","A gentle hydrating cleanser packed with ceramides and colloidal oatmeal to nourish skin while effectively melting away makeup, SPF, and excess oil. For normal, dry, combination, and oily skin types. For skincare concerns of dryness, redness, and oiliness. This product is vegan, cruelty-free, and comes in recyclable packaging. ",https://www.sephora.com/ca/en/product/glow-recipe-avocado-ceramide-moisture-barrier-cleanser-P503634?skuId=2661239&icid2=products%20grid:p503634:product
Glucoside Foaming Cleanser,Cleanser,The Ordinary,,14.8,150 mL,Liquid,"Aqua (Water), Decyl Glucoside, Coco Glucoside, Xanthan Gum, Tocopherol, Phytic Acid, Benzyl Alcohol, Ethylhexylglycerin.
","A gentle, foaming cleanser that effectively cleanses the skin while maintaining the skin’s moisture barrier. For normal, dry, combination, and oily skin types. For skincare concerns of pores and oiliness. The Glucoside Foaming Cleanser is a gel-like foaming cleanser that effectively helps remove dirt and environmental impurities. This formulation helps maintain the skin's moisture barrier, while also improving the look of skin’s clarity, texture, radiance, and suppleness with continued use. ",https://www.sephora.com/ca/en/product/the-ordinary-glucoside-foaming-cleanser-P505274?skuId=2644151&icid2=products%20grid:p505274:product